stop_id,stop_name,stop_lat,stop_lon
1705,"Cabra, Skreen Road (Ardpatrick Road)",53.3621807471602,-6.30847083369411
1706,"Cabra, Cemetery",53.3600698255997,-6.307292375272441
1707,"Cabra, Blackhorse Avenue",53.358428266349,-6.302459572671309
1708,"Cabra, McKee Barracks",53.35733235447471,-6.29871714548453
1709,"Cabra, Blackhorse Avenue (Glenbeigh Avenue)",53.3568682016769,-6.297052991437269
1710,"Arbour Hill, Drumalee Estate",53.3555699040255,-6.29174149147947
1711,"Arbour Hill, The Holy Family Church",53.3545779754891,-6.28963290156871
1712,"Arbour Hill, Aughrim Street",53.353333917003205,-6.286242591763839
1713,"Arbour Hill, Stanhope Street Convent",53.351907820017004,-6.283325473453231
1714,"Arbour Hill, Brunswick Street",53.3506378069371,-6.28188938800201
1715,"Smithfield, Blackhall Street",53.3477119821784,-6.282187299518559
1724,"Dollymount, Clontarf Road (near Mount Prospect Ave)",53.3657153153763,-6.17444158948899
1725,"Dollymount, Doyle's Lane",53.3637602626912,-6.17707965691367
1726,"Dollymount, Dollymount Park",53.3622913896674,-6.179185876116639
1727,"Dollymount, Kincora Road",53.36060397370629,-6.182878901225999
1728,"Dollymount, Conquer Hill Road",53.3596562743545,-6.186164596251321
1729,"Dollymount, Clontarf Bus Garage",53.358481218099,-6.190466418739719
1730,"Dollymount, Vernon Court",53.35823109074121,-6.19412792894392
1731,"Clontarf, Clontarf Road at Church",53.359096533758,-6.19667556587985
1732,"Clontarf, Oultan Road",53.36009974550839,-6.2024027873027805
1733,"Clontarf, Clontarf Road (near Scoil Uí Chonaill)",53.3602126155145,-6.20631955975878
1734,"Clontarf, Clontarf Road (Castle Avenue)",53.3603891356074,-6.210293782896559
1735,"Clontarf, Styles Road",53.361143327090595,-6.21443920712788
1736,"Clontarf, Saint Lawrence Road",53.3621421815528,-6.2169217466278495
1737,"Clontarf, Saint Lawrence Road",53.3621895624005,-6.2170850503091595
1738,Clontarf Road Junction Alfie Byrne Road,53.3628941786378,-6.21973023935834
1739,"Marino, Clontarf Road (at DART Station)",53.363885194630896,-6.22652585924791
1740,"Marino, Clontarf Road (at DART Station)",53.36414161674621,-6.2268457873413094
1741,Clontarf Road Junction Strandville Avenu,53.3629172715096,-6.2206759088764505
1742,"Clontarf, Saint Lawrence Road",53.36212579331529,-6.216426584861621
1743,"Clontarf, Styles Road",53.3611356864305,-6.21392866651198
1744,"Clontarf, Clontarf Road (Castle Avenue)",53.360384795336294,-6.20880648543212
1745,"Clontarf, Clontarf Road (near Scoil Uí Chonaill)",53.3603821064624,-6.20563631294093
1746,"Clontarf, Oultan Road",53.3602565190474,-6.20266663792763
1747,"Clontarf, Clontarf Road at Church",53.35930267631021,-6.1966368112015
1748,"Dollymount, Vernon Court",53.3582570201128,-6.19346576182192
1749,"Dollymount, Clontarf Bus Garage",53.3586249368601,-6.190460328809889
1750,"Raheny, Thornhill Lane",53.3688677027256,-6.17780832862968
1751,"Dollymount, Conquer Hill Road",53.359812707362394,-6.185812378842259
1752,"Dollymount, Seaview Point",53.3611275917068,-6.181849918585661
1753,"Dollymount, Dollymount Park",53.3621186154932,-6.179644015647991
1754,"Dollymount, Dollymount Avenue",53.364115656468705,-6.176809033574701
1755,"Dollymount, Seapark Apartments",53.366429976972,-6.18712407524492
1756,"Dollymount, Mount Prospect Ave (Dollymount Ave)",53.3672099080423,-6.182853198627879
1757,"Raheny, Park Lawn",53.368629641887104,-6.182236727622611
1758,"Dollymount, Baymount Park",53.3681296759012,-6.175390292328269
1759,"Dollymount, Clontarf Road (near Mount Prospect Ave)",53.366000222729795,-6.174264108430309
1760,"Dollymount, Seapark Road (Mount Prospect Avenue)",53.3659722446511,-6.187759621923091
1761,Seapark Road (Seafield Road),53.3638373979427,-6.188045579854679
1762,"Dollymount, Seafield Road East (Seafield Avenue)",53.36375118736779,-6.19124983539217
1763,"Dollymount, Vernon Avenue",53.3644067789412,-6.1953693752523895
1764,"Clontarf, Black Heath Court",53.365892968742706,-6.19557704044883
1765,"Clontarf, Blackheath Grove",53.3665617639449,-6.20237114167197
1766,"Clontarf, Blackheath Grove",53.36663226629889,-6.20227800944198
1767,"Clontarf, Clontarf Castle",53.3651156005984,-6.20482128202738
1769,"Dollymount, Mount Prospect Avenue",53.368885783569205,-6.1819402864647905
1770,"Dollymount, Mount Prospect Avenue",53.367083468779,-6.18281349818964
1771,"Dollymount, Saint Gabriel's Road",53.36604192033171,-6.185247140158861
1772,"Clontarf, Saint John The Baptist Cemetery",53.36501074751389,-6.20502103771963
1773,"Clontarf, Blackheath Park",53.3668109134426,-6.2033975358373405
1774,"Clontarf, Blackheath Park (Blackheath Avenue)",53.366120994307096,-6.19758103342006
1775,"Dollymount, Vernon Avenue",53.3644399833339,-6.19518765370067
1776,"Dollymount, Seafield Road East (Seafield Avenue)",53.3638160053874,-6.1919683516038395
1777,"Dollymount, Seafield Avenue",53.3653120792154,-6.1910484659595
1778,"Dollymount, Mount Prospect Avenue (Mount Prospect Park)",53.3666136880704,-6.1891599851722505
1782,"Artane, Gracefield Road",53.3823894993402,-6.1981716507413305
1783,"Artane, Saint Brendan's School",53.3838032158922,-6.19596218165506
1784,"Coolock, Gorsefield Court",53.384620981283,-6.1929810133564605
1785,"Harmonstown, McAuley Drive",53.3825960633072,-6.191623614929769
1786,"Harmonstown, Ribh Road",53.3819941363959,-6.19223540172876
1788,"Edenmore, Millbrook Road (Tonlegee Road)",53.391614051062,-6.17880643395275
1789,"Edenmore, Millbrook Road",53.3942624574249,-6.1786031191802095
1791,"Edenmore, GAA Sports Ground",53.3965874453453,-6.18194749011522
1792,"Edenmore, Millbrook Road",53.3935247615054,-6.17855943972057
1793,"Edenmore, Millbrook Road (Tonlegee Road)",53.3916843046716,-6.17869818119338
1794,"Raheny, Thornhill Lane",53.3694410695083,-6.17945199515198
1795,"Cabra, Cabra Road",53.3615033956228,-6.296868142243559
1796,"Harmonstown, McAuley Park",53.381789345579996,-6.19117676197823
1797,"Harmonstown, McAuley Drive",53.383127845385395,-6.19172134030205
1798,"Artane, Ainninn Drive",53.384383910038096,-6.19453950864013
1799,"Artane, Mask Crescent",53.383058682835504,-6.196655117597049
1800,"Artane, Gracefield Road",53.3823067907417,-6.19924247171126
1801,"Artane, Gracefield Road",53.3823969984385,-6.20224522816109
1802,"Cabra East, Cabra Road (Carnlough Road)",53.361380323440706,-6.294544145495629
1803,"Cabra East, Cabra Road (Carnlough Road)",53.361563598703796,-6.2941611939632205
1804,"Cabra, Cabra Road",53.3616973947104,-6.29723603716658
1805,"Cabra, Dunard Estate",53.36116270390801,-6.29755786085374
1806,"Cabra, Navan Road",53.3629069059087,-6.302642142098151
1807,"Ashtown, Navan Road (Old Race Course)",53.3744144643082,-6.339262883404549
1847,"Ashtown, Navan Road (Old Race Course)",53.3749277583846,-6.339979374433991
1905,"Cabra, Navan Road",53.3633746469215,-6.30329971300526
1906,"Cabra, Cabra Cross",53.36120076202029,-6.29707553938411
1907,"Cabra East, Railway Bridge",53.3599049453531,-6.29382178508836
1908,"Cabra East, Cabra Drive",53.3586907975484,-6.291256072768429
1909,"Arbour Hill, Prussia Street",53.356960263150995,-6.28841072316956
1911,"Arbour Hill, Prussia Street",53.3566345096131,-6.28825851915213
1913,"Cabra East, Cabra Drive",53.358806332072,-6.29179232473619
1914,"Cabra East, Old Cabra Road",53.360215762689506,-6.2948160274661396
1934,"Temple Bar, Dame Street",53.3442905615546,-6.2656234692016195
1935,"Dublin City South, Carnegie Centre",53.343934346215896,-6.26832635157409
1937,"Liberties, High Street",53.3430874992184,-6.27315167433484
1938,"Liberties, Thomas Street (John Street)",53.3429778949688,-6.27676060847678
1939,"Liberties, Thomas Street (St. Catherine's Lane)",53.3429982683414,-6.280664666542799
1940,"James's Gate, James Street",53.3435386006474,-6.285734347932321
1941,"James's Gate, James Street",53.3433454019831,-6.28918142026463
1942,"Kilmainham, Saint James Hospital",53.34225498339929,-6.29463172936893
1943,"Kilmainham, Mount Brown",53.341373263699104,-6.2983463657131695
1944,"Kilmainham, Old Kilmainham",53.3406753265043,-6.303615405340401
1945,"Inchicore, Emmett Road",53.34055478416929,-6.30968740041896
1946,"Inchicore, Emmet Road",53.34011880493179,-6.316357476886799
1947,"Inchicore, Emmet Road",53.3398178565031,-6.31796119520697
1948,"Inchicore, Tyrconnell Road",53.3386701347326,-6.3219859134116305
1949,"Inchicore, Tyrconnell Road",53.3376414795987,-6.323618080346769
1950,"Inchicore, Church",53.336021044247296,-6.32599413397449
1951,"Bluebell (Dublin City), Lansdowne Valley Park",53.3331348380325,-6.3291252191704706
1952,"Bluebell (Dublin City), Lansdowne Valley Park",53.331550549881705,-6.33023816806491
1953,"Bluebell, Entrance to Bluebell",53.32999449949221,-6.33208562071694
1954,"Bluebell, Naas Road",53.3287741741428,-6.334805659054769
1955,"Bluebell (Dublin City), Carriglea Industrial Estate",53.327945707171004,-6.3379156633767995
1956,"Bluebell, Naas Road (Kylemore Road)",53.3263654179245,-6.34384709401736
1981,"Bluebell, Naas Road (Kylemore Road)",53.3264867532132,-6.344818227471559
1982,"Bluebell, Naas Road (Kylemore Road)",53.3272299503082,-6.34202704890607
1984,"Bluebell, Naas Road",53.3294445318954,-6.333893729471379
1985,"Bluebell (Dublin City), Lansdowne Valley Park",53.3329236566366,-6.32944879131458
1986,"Inchicore, Tyrconnell Road",53.3353553796487,-6.32723649887249
1987,"Inchicore, Oblate of Mary Immaculate Church",53.3362899055526,-6.32593855473876
1988,"Inchicore, Oblate Church",53.3382603815004,-6.322888004933599
1989,"Inchicore, Camac Close",53.3397064788455,-6.31898677046978
1990,"Inchicore, Emmet Road",53.34047278179499,-6.31469157313953
1992,"Inchicore, Emmett Road",53.3406544981518,-6.3091127770197595
1993,"Kilmainham, Old Kilmainham",53.34085366139271,-6.30477972664047
1994,"Kilmainham, Saint James's Hospital",53.3414239628449,-6.29938060050009
1995,"Kilmainham, Ewington Lane",53.342675185966705,-6.29321822745695
1996,"James's Gate, James Street",53.343560071834204,-6.288481953764019
1997,"James's Gate, James Street",53.343571081213,-6.2854927415615
1998,"Liberties, Thomas Street (St. Catherine's Lane)",53.3431396148983,-6.280493772137111
1999,"Liberties, Thomas Street (John Street)",53.3431192358309,-6.27658970136464
2001,"Dublin City South, Saint Audeon's Church",53.34331047323089,-6.27365330535553
2002,"Dublin City South, Lord Edward Street",53.343770806586505,-6.269444390031401
2003,"Dublin City South, Lord Edward Street",53.34404126860029,-6.2682619415957
2085,"Donnybrook, R.T.E. Televison Studios",53.3151737463869,-6.2201861561969505
2086,"Merrion, Nutley Lane",53.3181567845485,-6.21470338209092
2087,"Merrion, Merlyn Park",53.3206094716409,-6.212829685015009
2088,"Merrion, Nutley Lane (Saint Vincent's Hospital)",53.3172966893469,-6.216090174696231
2089,"Donnybrook, Elm Park Golf Club",53.315301993767,-6.21974555361791
2094,"The Coombe, Coombe Maternity Hospital",53.334751966404895,-6.28975063819718
2095,"Crumlin, Crumlin College",53.3290374667768,-6.3024707515015
2096,"Crumlin, Crumlin Road",53.32808359048121,-6.306817491016541
2097,"Crumlin, Iveagh Gardens",53.3274327540337,-6.30972580638998
2099,"Drimnagh, Crumlin Road (Cooley Road)",53.325561581391604,-6.31660046938251
2101,"Walkinstown, Crumlin Childrens Hospital",53.3249374452139,-6.31823136157804
2102,"Drimnagh, Drimnagh Rd, Balfe Rd",53.3242410248988,-6.32623016690377
2103,"Walkinstown, Shopping Centre",53.322082695480006,-6.32999241707338
2105,"Drimnagh, Long Mile Road",53.3236628172002,-6.337586750676239
2181,"Drimnagh, Long Mile Road",53.3239009854205,-6.33919877923563
2182,"Drimnagh, Walkinstown Parade",53.323961923457794,-6.3351882219874796
2183,"Walkinstown, Walkinstown Road (Kilnamanagh Road)",53.321703980838,-6.330547608848259
2184,"Walkinstown, Walkinstown Rd, Drimnagh Rd",53.3229966132175,-6.32914609742308
2185,"Drimnagh, Drimnagh Road (Slievebloom Road)",53.3242691584508,-6.327595164886461
2186,"Drimnagh, Raphoe Road",53.3269332843419,-6.31253797965373
2187,"Crumlin, Iveagh Grounds",53.3280452768584,-6.30728442530442
2188,"Crumlin, Crumlin College",53.329016922829894,-6.30292198124809
2189,"Crumlin, Crumlin Shopping Centre",53.329695395882,-6.30007240820087
2190,"Dolphins Barn, Dolphin's Barn",53.3329461498259,-6.292315414198481
2191,"Islandbridge, Sarah Place",53.3480255718777,-6.3104432646711395
2192,"Islandbridge, U.C.D Boat Club",53.347245622936,-6.315671092884691
2193,"Islandbridge, Garda Boat Club",53.346384550387704,-6.32345529052176
2194,"Islandbridge, Sports Grounds",53.3461933372464,-6.32840430346692
2195,"Chapelizod, Chapelizod School",53.34674411380529,-6.337589992731969
2196,"Chapelizod, Kings Hall",53.347834625121095,-6.341678151466731
2197,Lucan Road (Chapelizod Hill Rd),53.3481655534101,-6.34674221487069
2198,"Chapelizod, Lucan Road (Belgrove Park)",53.3506251417954,-6.351063288605241
2199,"Ballyfermot, Old Lucan Road",53.351968295854704,-6.35590853399226
2200,"Chapelizod, Chapelizod By Pass Bridge",53.3502827503671,-6.35295415067497
2243,"Chapelizod, Lucan Road",53.351974382681504,-6.35569799515708
2244,"Chapelizod, Lucan Road (Belgrove Park)",53.3508843467058,-6.35160907436147
2245,"Chapelizod, Lucan Road (Laurence Brook)",53.349463204704506,-6.348284211289981
2246,"Chapelizod, Chapelizod Bridge",53.34831130883921,-6.34364235370793
2247,"Chapelizod, Chapelizod School",53.3467528589766,-6.33628291602209
2248,"Islandbridge, Sports Grounds",53.3463209318655,-6.327888637316019
2249,"Islandbridge, Neptune Rowing Club",53.346531704727106,-6.32113644944898
2250,"Islandbridge, Salmon Pool",53.3474385870512,-6.31533304000412
2251,"Islandbridge, Islandbridge Park Gate",53.3481320367099,-6.310979792308941
2255,"North Strand, Annesley Bridge",53.360230096372206,-6.23826189020208
2256,"East Wall, Portside Court",53.35834894122971,-6.235650152442419
2257,"East Wall, West Road",53.356382415651396,-6.23821028357833
2258,"East Wall, Saint Joseph's Church",53.3546537542947,-6.23801117708441
2259,"East Wall, Church Road",53.353538130695895,-6.23672019068215
2260,"East Wall, Church Road",53.35177850777579,-6.2350352598176695
2261,"East Wall, Church Court Estate",53.3526385466371,-6.23241589368512
2262,"East Wall, Merchants Road",53.3535229015383,-6.2265956020448305
2264,"Tolka Quay, Dublin Graving Docks",53.351135646297294,-6.2226087958312695
2265,"Tolka Quay, Alexandra Road (Branch Road)",53.351049776264,-6.21986339189806
2269,"Tolka Quay, Breakwater Road South",53.3503077646651,-6.20334062781966
2270,"Tolka Quay, Irish Ferries Terminal",53.345706120618,-6.195618655047599
2274,"Tolka Quay, Alexandra Road",53.3501863044238,-6.2036311442849
2278,"East Wall, Bargy Road",53.3543808286375,-6.2298950613210495
2279,"East Wall, Caledon Road",53.3529413710509,-6.23162219875026
2280,"East Wall, Church Road",53.3523117215819,-6.237056238673071
2281,"East Wall, Church Road",53.353664109754604,-6.23673001255049
2282,"East Wall, Saint Joseph's Church",53.3548411662372,-6.23852925147983
2283,"East Wall, Portside Court",53.3583262112741,-6.2359365524329995
2310,"Dublin City South, Werburgh Street",53.342445701798894,-6.26979842837403
2311,"Dublin City South, Kevin Street Garda Station",53.338285282662895,-6.27049246703832
2312,"Warrenmount, The Coombe",53.338878854575206,-6.27548423467162
2313,"The Coombe, Ardee Court",53.3387423330556,-6.27847818154428
2314,"The Coombe, Cork Street",53.338353683685,-6.28082149273868
2315,"The Coombe, Marion Villas",53.3375364314381,-6.285239284299459
2317,"Drimnagh, Crumlin Bowling Club",53.323418568712704,-6.31887655923768
2318,"Crumlin, Somerville Avenue",53.3219800054738,-6.318843045528211
2319,"Crumlin, Garda Station",53.3195097880904,-6.315127501487781
2320,"Walkinstown, Whitehall Road West (Kimmage Rd)",53.3158872230165,-6.3170112655487
2321,"Walkinstown, Crumlin Crossroads",53.313404842599894,-6.32008057357709
2322,"Walkinstown, Whitehall Road West",53.310237492123896,-6.32110538006182
2323,"Walkinstown, Millgate Drive",53.308107550648096,-6.32048365937229
2324,"Walkinstown, Whitehall Road West",53.3097868581281,-6.321018015221861
2325,"Walkinstown, Whitehall Road West (Limekiln Ln)",53.3121174975418,-6.3212116918170596
2326,"Walkinstown, Crumlin Crossroads",53.3137000175459,-6.31997893105515
2327,"Walkinstown, St. Agnes Road (Cromwellsfort Rd)",53.3168199827989,-6.316869496467191
2328,"Walkinstown, Saint Agnes Church",53.319587161839294,-6.315514725196099
2329,"Walkinstown, Saint Agnes Road",53.32084969817039,-6.3170861723169995
2330,"Walkinstown, Saint Agnes Road",53.3221480438959,-6.31928677990814
2331,"Walkinstown, Saint Mary's Road",53.324571774923896,-6.31779537774905
2332,"Walkinstown, Walkinstown Road (Kilnamanagh Road)",53.32106265301479,-6.3309629297521
2333,"Walkinstown, Walkinstown Road (Walkinstown Roundabout)",53.3178417645942,-6.33266465395949
2378,"Walkinstown, Walkinstown Road (Walkinstown Roundabout)",53.31853179024839,-6.33251767303031
2379,"The Coombe, Marion Villas",53.3378334357789,-6.2846417070798894
2380,"The Coombe, Cork Street",53.3385060739011,-6.2801696235630295
2382,"The Coombe, Brabazon Row",53.338857810983,-6.27838342591743
2383,"The Coombe, Saint Patrick's Cathedral",53.339458068261,-6.272652582553341
2385,"Dublin City South, Back Avenue",53.3423151191354,-6.27195136781827
2386,"Warrenmount, New Street South",53.337907367524096,-6.2723248169914605
2387,"Warrenmount, New Street South",53.336584424719106,-6.2728287910104905
2388,"Warrenmount, Clanbrassil Street",53.3344588046365,-6.27438623129611
2389,"Harolds Cross, Harold's Cross",53.324929029201705,-6.27919952128774
2390,"Harolds Cross, Mount Argus Park",53.3215286268265,-6.2839898347087
2391,"Kimmage, Mount Argus Church",53.320197513324295,-6.2864299556654295
2392,"Kimmage, Mount Argus Community Centre",53.3188913455654,-6.2912405478478
2393,"Kimmage, Lower Kimmage Road (Aideen Avenue)",53.315203611307794,-6.295455304632361
2394,"Terenure, Poddle Park",53.3132590569273,-6.29775401743367
2395,"Kimmage, Fortfield Road",53.3117355838446,-6.30059107181305
2396,Wainsfort Estate,53.308819067833795,-6.30217757945116
2397,"Terenure, College Drive",53.3065891639891,-6.30085550798026
2398,"Terenure, Fortfield Estate",53.3053439550566,-6.29988458197654
2409,"Terenure, Fortfield Estate",53.3053912217933,-6.30004776457778
2410,"Terenure, College Drive",53.3072258809457,-6.301385450000019
2411,Wainsfort Estate,53.3091732491352,-6.30243364694296
2412,"Kimmage, Lavarna Estate",53.3109352197486,-6.3018234623024
2413,"Kimmage, Kimmage Road West (Whitehall Road)",53.312865794885795,-6.30548384645275
2414,"Kimmage, Kimmage Road West",53.313980815653494,-6.310587594594059
2415,"Walkinstown, Royston Village",53.314966070825996,-6.31352043237578
2416,"Walkinstown, Cromwellsfort Road (Whitehall Road)",53.316399376262204,-6.31763651485731
2417,"Walkinstown, Cromwellsfort Road (Cherry Grove)",53.316635224112,-6.322895542274719
2418,"Walkinstown, Cromwellsfort Road (Bigger Road)",53.316969952115,-6.326889959308139
2419,"Walkinstown, Cromwell's Fort Road (Walkinstown Roundabout)",53.317079922615,-6.33024779704376
2431,"Walkinstown, Cromwell's Fort Road (Walkinstown Roundabout)",53.317203212876905,-6.330708281154849
2432,"Walkinstown, Cromwellsfort Road (Bigger Road)",53.31701346672111,-6.325507380031411
2433,"Walkinstown, Cromwellsfort Road (Cherry Grove)",53.316586230994204,-6.320691082543019
2434,"Crumlin, Kimmage Road West",53.3160265967778,-6.316060201415009
2435,"Crumlin, Westbrook",53.31426906236529,-6.3112666059906
2436,"Kimmage, Kimmage Road West",53.313705907017095,-6.30894752705153
2437,"Kimmage, Kimmage Road West (Whitehall Road)",53.3126888171566,-6.30251926023377
2438,"Kimmage, Lower Kimmage Road (Fortfield Road)",53.3124895224759,-6.29925542426284
2439,"Terenure, Poddle Park",53.3135458708946,-6.297697578709671
2440,"Kimmage, Lower Kimmage Road (Aideen Avenue)",53.316400874739706,-6.294326915289769
2441,"Kimmage, Mount Argus Community Centre",53.3190611622795,-6.291173721530759
2442,"Kimmage, Mount Argus Church",53.320452414384896,-6.28602946037107
2443,"Kimmage, Brookfield",53.3218921780869,-6.28364499642882
2444,"Harolds Cross, Lower Kimmage Road",53.32429773545521,-6.27967529321174
2448,"Crumlin, Healthcare Centre",53.31924636602,-6.304150300406031
2449,"Crumlin, Armagh Road",53.320985181203696,-6.30507207177197
2450,"Crumlin, Saint Agnes Primary School",53.320231099989606,-6.307668789242519
2451,"Crumlin, Saint Agnes Park",53.3192110956384,-6.314343721371981
2452,"Walkinstown, Saint Peter's Road (Walkinstown Roundabout)",53.3161898761675,-6.3321586972054895
2453,"Walkinstown, Saint Peter's Road (Saint James's Road)",53.3148278807863,-6.33053082340999
2462,St.James's Road (St.Peter's Road),53.3138231906995,-6.33002973232323
2463,"Walkinstown, Saint Peter's Road (Walkinstown Roundabout)",53.3153044515163,-6.33118762432682
2464,"Crumlin, Stannaway Avenue",53.3195160340252,-6.3130257940082
2465,"Crumlin, Armagh Road (Captain's Road)",53.3199884645803,-6.30893928264191
2466,"Crumlin, Scoil Colm",53.320654234514706,-6.3064511763571
2467,"Crumlin, Health Centre",53.319234183388794,-6.30392562805676
2471,"Kimmage, Larkfield Park",53.31878959048739,-6.2891581905344704
2472,"Harolds Cross, Clareville Road",53.3176779065494,-6.28560029534873
2473,"Harolds Cross, Clareville Road",53.31789900740271,-6.283475031440309
2474,"Harolds Cross, Clareville Road",53.3187042704261,-6.28197170964776
2475,"Harolds Cross, Kenilworth Park",53.318865886939,-6.28008893179158
2476,"Harolds Cross, Kenilworth Square North",53.3190374256211,-6.27765035669855
2477,"Rathmines, Kenilworth Square East",53.319861713919494,-6.2743598495266
2478,"Rathmines, Grosvenor Road",53.3205775910637,-6.269797669186279
2479,"Rathmines, Grosvenor Road",53.3202929682022,-6.270004325120929
2480,"Rathmines, Kenilworth Square East",53.3197374727229,-6.274469936999179
2481,"Harolds Cross, Kenilworth Square North",53.3187380715415,-6.27808269931127
2482,"Harolds Cross, Clareville Road",53.3189206310816,-6.28139262665718
2483,"Harolds Cross, Westfield Road",53.318418545377504,-6.28210326846722
2484,"Kimmage, Larkfield Park",53.3185468354216,-6.28915289128925
2485,"Kimmage, Sundrive Road",53.319791576540005,-6.291339673757481
2486,"Kimmage, Sundrive Road",53.32107539740371,-6.29311972472245
2487,"Kimmage, Stannaway Road",53.32181637696979,-6.29528179712861
2488,"Kimmage, Stannaway Road",53.3203554286508,-6.2987174578256395
2489,"Kimmage, Stannaway Road",53.3195711253747,-6.30044484348436
2490,"Crumlin, Captain's Road",53.3195465424524,-6.30946711259829
2491,"Crumlin, Captain's Road (Captain's Avenue)",53.318027655233706,-6.308206276552959
2492,"Crumlin, Stannaway Court",53.316306360107696,-6.3078841189140595
2493,"Crumlin, Captain's Road (Captain's Avenue)",53.3183304784348,-6.30864459888039
2494,"Crumlin, Clonfert Road",53.3196538962319,-6.30057664879359
2495,"Kimmage, Stannaway Road",53.3212453601224,-6.2968356906962
2496,"Kimmage, Sundrive Road",53.322012448828204,-6.29390794719118
2497,"Kimmage, Sundrive Road",53.320329951614106,-6.29190358357237
2498,IFSC Custom House Quays,53.3482435389377,-6.25011187758655
2499,Jury's Inn Custom House Quay,53.348127826176096,-6.247127509792991
2500,"Docklands, Samuel Beckett Bridge",53.347736568334206,-6.24191642483209
2501,"Docklands, North Wall Quay (New Wapping Street)",53.347375911185104,-6.23635869880854
2508,"East Wall, Docklands main gate",53.3528641016115,-6.22581174728395
2634,"Warrenmount, Lower Clanbrassil Street",53.33289127449739,-6.27538045641685
2635,"Warrenmount, Lower Clanbrassil Street",53.3342508123621,-6.274920177875369
2636,"Warrenmount, New Street South",53.3365804387889,-6.2731743321603295
2637,Outside Heuston Train Station,53.3458840623207,-6.29385604999966
2638,"Heuston Station, Saint John's Road West",53.345658753705905,-6.296959098352799
2640,"Kilmainham, Kilmainham Jail",53.3420874262718,-6.31001725280125
2641,"Inchicore, Camac Court",53.341966007297,-6.31541363492027
2642,"Inchicore, Grattan Crescent",53.341182136261,-6.3197396964349295
2643,"Inchicore, Sarsfield Road",53.3415322602158,-6.3209874548759695
2644,"Islandbridge, Sarsfield Medical Centre",53.3419905931283,-6.327382265626191
2645,"Ballyfermot, Lally Road",53.3416965343707,-6.330772870229059
2646,"Ballyfermot, Decies Road (O'Moore Road)",53.34149448583071,-6.33367925990101
2647,"Ballyfermot, Markievicz Park",53.3406470674021,-6.3380073982225795
2648,"Ballyfermot, Decies Road (Garryowen Rd)",53.3397230210145,-6.34265370103926
2649,"Ballyfermot, Decies Road (Ramillies Rd)",53.339110576728295,-6.34580104128991
2650,"Ballyfermot, Landen Road",53.3377655575806,-6.346679023362
2652,Kylemore Road (Kylemore Avenue),53.3388722758274,-6.34806284007159
2653,"Ballyfermot, Ballyfermot Crescent",53.34023476518251,-6.348445684630559
2654,"Ballyfermot, Kylemore Road (Ballyfermot Road)",53.341298730205004,-6.34868990718238
2655,"Ballyfermot, Ballyfermot Parade",53.342138159216496,-6.352847576467349
2656,"Ballyfermot, Ballyfermot Road (Le Fanu Road)",53.3426234944756,-6.35871610719475
2657,"Ballyfermot, Le Fanu Park",53.3413170608764,-6.36175486590333
2658,"Ballyfermot, Oranmore Road",53.3391624351795,-6.36128182324467
2659,"Parkwest, Raheen Park",53.3370212365361,-6.36047794826205
2660,"Parkwest, Cherry Orchard Avenue",53.335775038314296,-6.3607059434799895
2661,"Parkwest, Cherry Orchard Avenue",53.3354860616875,-6.36519177724852
2662,"Parkwest, Cherry Orchard Avenue (Croftwood)",53.336793522656095,-6.37009717708455
2663,"Parkwest, Cherry Orchard Avenue (Croftwood)",53.3369139961318,-6.37036287855574
2664,"Parkwest, Cherry Orchard Avenue",53.335601198999996,-6.365067245672559
2665,"Parkwest, Cherry Orchard Avenue",53.3358803625996,-6.36052171092519
2666,"Parkwest, Raheen Park",53.3377901756433,-6.3608388865932906
2667,"Ballyfermot, Clifden Road",53.340697628268394,-6.36180864778955
2668,"Ballyfermot, Community Centre",53.343027957142,-6.36329626260096
2670,"Ballyfermot, Spiddal Park",53.34038993938089,-6.3675571895093395
2672,"Ballyfermot, Ballyfermot Road (Blackditch Road)",53.3433589409048,-6.367774177358121
